product>>brand,product>>category,product>>currency,product>>date,product>>description,product>>images,product>>name,product>>price,product>>sku,product>>url,product>>variations
Dyson,Gifts|Gifts by Category|Unique Gifts,USD,2017-12-07T00:05:23.532Z,"Dyson's Supersonic Hair Dryer uses intelligent heat control technology to help to prevent heat damage to your hair, preserving its natural shine. This high-speed and powerful hair dryer works to straighten and smooth delivering beautiful silky hair.",https://s7d9.scene7.com/is/image/BedBathandBeyond/145513347275522p?scl=1|https://s7d9.scene7.com/is/image/BedBathandBeyond/98918847339040p?scl=1|https://s7d2.scene7.com/is/image/BedBathandBeyond/10160953308317m?scl=1|https://s7d9.scene7.com/is/image/BedBathandBeyond/10160953308317m?scl=1,Dyson Supersonic Hair Dryer,399.99,,https://www.bedbathandbeyond.com/store/product/dyson-supersonic-hair-dryer/3308317,IRON/FUCHSIA|WHITE/SILVER
KitchenAid,Kitchen|Small Appliances|Mixers & Attachments,USD,2017-12-07T00:05:25.430Z,"This high-performance, 325 watt KitchenAid Artisan Stand Mixer is reason enough for you to get busy in the kitchen. With a 5 qt. ultra durable stainless steel mixing bowl and 10 speed settings, this tilt-back-head all-metal mixer is a kitchen essential.",https://s7d9.scene7.com/is/image/BedBathandBeyond/21686512370920p?scl=1|https://s7d9.scene7.com/is/image/BedBathandBeyond/15710817825569p?scl=1|https://s7d9.scene7.com/is/image/BedBathandBeyond/68875814073710p?scl=1|https://s7d9.scene7.com/is/image/BedBathandBeyond/46977543004843p?scl=1|https://s7d9.scene7.com/is/image/BedBathandBeyond/7366314872353p?scl=1|https://s7d9.scene7.com/is/image/BedBathandBeyond/18935118698528p?scl=1|https://s7d9.scene7.com/is/image/BedBathandBeyond/58050514872485p?scl=1|https://s7d9.scene7.com/is/image/BedBathandBeyond/21685612370938p?scl=1|https://s7d9.scene7.com/is/image/BedBathandBeyond/17041218088827p?scl=1|https://s7d9.scene7.com/is/image/BedBathandBeyond/31002313317640p?scl=1|https://s7d9.scene7.com/is/image/BedBathandBeyond/24925813080976p?scl=1|https://s7d9.scene7.com/is/image/BedBathandBeyond/150305412370911p?scl=1|https://s7d9.scene7.com/is/image/BedBathandBeyond/21685714017224p?scl=1|https://s7d9.scene7.com/is/image/BedBathandBeyond/5789314222944p?scl=1|https://s7d9.scene7.com/is/image/BedBathandBeyond/21686413324514p?scl=1|https://s7d9.scene7.com/is/image/BedBathandBeyond/21686612963238p?scl=1|https://s7d9.scene7.com/is/image/BedBathandBeyond/21685812370962p?scl=1|https://s7d9.scene7.com/is/image/BedBathandBeyond/104721943004836p?scl=1|https://s7d9.scene7.com/is/image/BedBathandBeyond/21685912370989p?scl=1|https://s7d9.scene7.com/is/image/BedBathandBeyond/109395460419590p?scl=1|https://s7d9.scene7.com/is/image/BedBathandBeyond/109395760419613p?scl=1|https://s7d9.scene7.com/is/image/BedBathandBeyond/21686212863004p?scl=1|https://s7d9.scene7.com/is/image/BedBathandBeyond/109395660419606p?scl=1|https://s7d9.scene7.com/is/image/BedBathandBeyond/21685412370903p?scl=1|https://s7d9.scene7.com/is/image/BedBathandBeyond/25119914872426p?scl=1|https://s7d9.scene7.com/is/image/BedBathandBeyond/58001413227713p?scl=1|https://s7d9.scene7.com/is/image/BedBathandBeyond/21686012370997p?scl=1|https://s7d9.scene7.com/is/image/BedBathandBeyond/7366514872434p?scl=1|https://s7d9.scene7.com/is/image/BedBathandBeyond/21686112371004p?scl=1|https://s7d9.scene7.com/is/image/BedBathandBeyond/31722642049784p?scl=1|https://s7d9.scene7.com/is/image/BedBathandBeyond/26824312371012p?scl=1|https://s7d9.scene7.com/is/image/BedBathandBeyond/21685312366590p?scl=1|https://s7d1.scene7.com/is/image/BedBathandBeyond/150305412370911p?scl=1|https://s7d9.scene7.com/is/image/BedBathandBeyond/150305412370911p?scl=1,KitchenAid® Artisan® 5 qt. Stand Mixer,279.99,,https://www.bedbathandbeyond.com/store/product/kitchenaid-reg-artisan-reg-5-qt-stand-mixer/102986,ALMOND|AQUA|BLUE WILLOW|BORDEAUX|BOYSENBERRY|BROWN|BUTTERCUP|COBALT BLUE|CONTOUR SILVER|CRANBERRY|CRYSTAL BLUE|EMPIRE RED|GLOSS CINNAMON|GREEN APPLE|ICE|IMPERIAL BLACK|IMPERIAL GREY|LAVENDER|MAJESTIC YELLOW|MATTE BLACK|MATTE GRAY|METALLIC CHROME|OCEAN DRIVE|ONYX BLACK|PERSIMMON|PINK|PISTACHIO|SILVER|TANGERINE|WATERMELON|WHITE/SILVER|WHITE/WHITE
All-Clad,Gifts|Gifts by Interest|Gifts for the Cook,USD,2017-12-07T00:05:29.438Z,All-Clad is the first choice of serious cooks. Three-ply bonded construction has a pure aluminum core for even heat distribution and a non-reactive stainless-steel interior and exterior for stick-resistant and easy-to-clean benefits.,https://s7d1.scene7.com/is/image/BedBathandBeyond/1861812460112p?scl=1|https://s7d9.scene7.com/is/image/BedBathandBeyond/1861812460112p?scl=1,All-Clad 12-Quart Stainless Steel Multi-Cooker,149.99,12460112,https://www.bedbathandbeyond.com/store/product/all-clad-12-quart-stainless-steel-multi-cooker/1012460112,
Homedics,Health & Beauty|Massage & Relaxation|Massage,USD,2017-12-07T00:05:30.079Z,"Feel the soothing warmth of the HoMedics Shiatsu Neck and Shoulder Massager with the added heat to the shiatsu, vibrating, or combined settings. It's all customizable so you can feel comfortable and natural in your relaxation.",https://s7d1.scene7.com/is/image/BedBathandBeyond/46662342763468p?scl=1|https://s7d9.scene7.com/is/image/BedBathandBeyond/46662342763468p?scl=1|https://s7d9.scene7.com/is/image/BedBathandBeyond/46662342763468p__1?scl=1,HoMedics® Shiatsu Neck and Shoulder Massager with Heat,39.99,42763468,https://www.bedbathandbeyond.com/store/product/homedics-reg-shiatsu-neck-and-shoulder-massager-with-heat/1042763468,
Presto,Gifts|Gifts by Category|Unique Gifts,USD,2017-12-07T00:05:30.730Z,"Make delicious, authentic pizza parlor pizza at home. With the exclusive Roto-bake technology you can choose exactly how bubbly the cheese should be and precisely how crispy or chewy you'd like the crust.",https://s7d1.scene7.com/is/image/BedBathandBeyond/397311975038p?scl=1,Presto Pizzazz Pizza Cooker,59.99,11975038,https://www.bedbathandbeyond.com/store/product/presto-pizzazz-pizza-cooker/1011975038,
B. Smith,Same Day Delivery,USD,2017-12-07T00:05:31.182Z,"Offering an appetizing spread of food for your guests is easy with this Multi-Purpose Server and Tray from B. Smith. The set includes 4 bowls centered around a small condiment bowl, all which has a carved individual space on the bamboo tray.",https://s7d2.scene7.com/is/image/BedBathandBeyond/56518543233533p?scl=1|https://s7d9.scene7.com/is/image/BedBathandBeyond/56518543233533p?scl=1,B. Smith Multi-Purpose Server with Tray,39.99,43233533,https://www.bedbathandbeyond.com/store/product/b-smith-multi-purpose-server-with-tray/1043233533,
BedBathAndBeyond,More|Pet Care|Dog,USD,2017-12-07T00:05:31.949Z,You won't worry about your dog feeling bored if she has a Talking Babble Ball Small Pet Toy. This toy interacts with your pet when touched and automatically turns itself off. More than 20 recorded wisecracks and sounds will entertain and amuse your pet.,https://s7d1.scene7.com/is/image/BedBathandBeyond/61148915805684p?scl=1|https://s7d9.scene7.com/is/image/BedBathandBeyond/61148915805684p?scl=1|https://s7d9.scene7.com/is/image/BedBathandBeyond/61148915805684p__1?scl=1,Talking Babble Ball Small Pet Toy in Blue,4.99,15805684,https://www.bedbathandbeyond.com/store/product/talking-babble-ball-small-pet-toy-in-blue/1015805684,
BedBathAndBeyond,Home Decor|Decorative Accessories|Blankets & Throws,USD,2017-12-07T00:05:32.680Z,"Experience the exceptional warmth and silky hand of the oversized Mink Reversible Throw. The unique, textured plush faux mink reverses to a supple micro-mink, creating the ultimate cozy experience.",https://s7d9.scene7.com/is/image/BedBathandBeyond/51143742578123p?scl=1|https://s7d9.scene7.com/is/image/BedBathandBeyond/51143842578130p?scl=1|https://s7d1.scene7.com/is/image/BedBathandBeyond/5109213260360m?scl=1|https://s7d9.scene7.com/is/image/BedBathandBeyond/5109213260360m?scl=1,Mink Reversible Throw,19.99,,https://www.bedbathandbeyond.com/store/product/mink-reversible-throw/3260360,CHAMPAGNE|IVORY
Earth Therapeutics®,Gifts|Holiday Ideas|Secret Santa,USD,2017-12-07T00:05:33.360Z,Give the gift of moisturized skin with the delightfully festive Holiday Aloe Infused Glove & Sock Set from Earth Therapeutics. These super soft gloves and socks feature a charming holiday pattern and will moisturize your feet and hands in plush softness.,https://s7d2.scene7.com/is/image/BedBathandBeyond/131437262216319p?scl=1|https://s7d9.scene7.com/is/image/BedBathandBeyond/131437262216319p?scl=1|https://s7d9.scene7.com/is/image/BedBathandBeyond/131437262216319p__1?scl=1,Earth Therapeutics® Holiday Aloe Infused Glove & Sock Set in Red,9.99,62216319,https://www.bedbathandbeyond.com/store/product/earth-therapeutics-reg-holiday-aloe-infused-glove-sock-set-in-red/1062216319,
Earth Therapeutics®,Gifts|Gifts by Price|Gifts under $25,USD,2017-12-07T00:05:34.204Z,"Whether you need to relieve muscle tension with heat or reduce swelling with cold, this comfortable u-shaped pillow for your neck is the solution. Microwave it for a warm session, or freeze it to apply cool pressure to a problem area.",https://s7d1.scene7.com/is/image/BedBathandBeyond/12695316883646p?scl=1|https://s7d9.scene7.com/is/image/BedBathandBeyond/12695316883646p?scl=1,Anti-Stress Microwavable Neck Pillow,14.99,16883646,https://www.bedbathandbeyond.com/store/product/anti-stress-microwavable-neck-pillow/1016883646,
BedBathAndBeyond,More|Pet Care|Dog,USD,2017-12-07T00:05:35.020Z,"Like the song that has no end, the timeless appeal of Shari Lewis and LambChop® continues to bloom in the hearts and minds of millions of baby boomers, their children and even their pets!",https://s7d1.scene7.com/is/image/BedBathandBeyond/22484140218014p?scl=1|https://s7d9.scene7.com/is/image/BedBathandBeyond/22484140218014p?scl=1,LambChop® 24-Inch Pet Toy,14.99,40218014,https://www.bedbathandbeyond.com/store/product/lambchop-reg-24-inch-pet-toy/1040218014,
BedBathAndBeyond,Gifts|Gifts by Price|Gifts under $25,USD,2017-12-07T00:05:35.654Z,This abnormally large beer glass is designed to hold over 4 beers. Perfect for the avid beer drinker.,https://s7d1.scene7.com/is/image/BedBathandBeyond/33634442099352p?scl=1|https://s7d9.scene7.com/is/image/BedBathandBeyond/33634442099352p?scl=1,DCI XL 52-Ounce Beer Glass,12.99,42099352,https://www.bedbathandbeyond.com/store/product/dci-xl-52-ounce-beer-glass/1042099352,
Pfaltzgraff,Dining|Glasses & Drinkware|Coffee Mugs,USD,2017-12-07T00:05:36.386Z,"Show everyone the importance of that first cup of coffee every morning with this witty ""I Drink Coffee for Your Protection"" Mug from Pfaltzgraff. Made of porcelain, this durable mug holds 18 oz. of java to get you fueled up for your day.",https://s7d2.scene7.com/is/image/BedBathandBeyond/66736144741013p?scl=1|https://s7d9.scene7.com/is/image/BedBathandBeyond/66736144741013p?scl=1,"Pfaltzgraff® ""I Drink Coffee For Your Protection"" Mug",4.99,44741013,https://www.bedbathandbeyond.com/store/product/pfaltzgraff-reg-i-drink-coffee-for-your-protection-mug/1044741013,
Maybelline,Health & Beauty|Beauty|Mascara & Eyeliner,USD,2017-12-07T00:05:37.028Z,Maybelline Lash Sensational Washable Mascara gives you a sensational full fan effect. The patented fanning brush with 10 layers of bristles reveals a full flourish of lashes. Liquid Ink formula coats from all sides creating dramatic full lashes.,https://s7d1.scene7.com/is/image/BedBathandBeyond/57144220257972p?scl=1|https://s7d9.scene7.com/is/image/BedBathandBeyond/57144220257972p?scl=1,Maybelline® Lash Sensational™ Washable Mascara in Brown Black,6.99,20257972,https://www.bedbathandbeyond.com/store/product/maybelline-reg-lash-sensational-trade-washable-mascara-in-brown-black/1020257972,
Blistex,Health & Beauty|Beauty|Lip Care,USD,2017-12-07T00:05:37.788Z,"Blistex Fruit Smoothies Lip Balm .30 oz. 3-Pack SPF 15, include 3 creamy blends with natural fruit extracts, flavors and vitamins: Melon Medley, Berry Explosion, and Triple Tropical.",https://s7d2.scene7.com/is/image/BedBathandBeyond/49933712762259p?scl=1|https://s7d9.scene7.com/is/image/BedBathandBeyond/49933712762259p?scl=1,Blistex Fruit Smoothies Lip Balm .30 oz. 3-Pack SPF 15,2.99,12762259,https://www.bedbathandbeyond.com/store/product/blistex-fruit-smoothies-lip-balm-30-oz-3-pack-spf-15/1012762259,
Burt's Bees,Health & Beauty|Beauty|Lip Care,USD,2017-12-07T00:05:38.420Z,"Burt's Bees Beeswax Lip Balm combines beeswax, coconut oil, peppermint oil and lanolin to give you moisturized and refreshed lips. 100% natural lip balm also features Vitamin E.",https://s7d2.scene7.com/is/image/BedBathandBeyond/49916520048921p?scl=1|https://s7d9.scene7.com/is/image/BedBathandBeyond/49916520048921p?scl=1,Burt's Bees® 2-Pack 0.15 oz. Beeswax Lip Balm,5.79,20048921,https://www.bedbathandbeyond.com/store/product/burt-39-s-bees-reg-2-pack-0-15-oz-beeswax-lip-balm/1020048921,
Keurig,Kitchen|Coffee & Tea|Coffee,USD,2017-12-07T00:05:39.084Z,"This wide selection of K-Cup Value Packs are designed for exclusive use with Keurig brewing systems. Each K-Cup Pack contains the precise amount of ingredients to let you easily make a perfectly brewed, single-serve cup of your favorite coffees.",https://s7d1.scene7.com/is/image/BedBathandBeyond/540501216022c?scl=1|https://s7d9.scene7.com/is/image/BedBathandBeyond/540501216022c?scl=1,Keurig® K-Cup® Pack Coffee Value Packs,23.99,,https://www.bedbathandbeyond.com/store/product/keurig-reg-k-cup-reg-pack-coffee-value-packs/216022,
KitchenAid,Kitchen|Small Appliances|Mixers & Attachments,USD,2017-12-07T00:05:39.741Z,This unique 5-quart tilt-head stand mixer is part of KitchenAid's Designer Series. This stand mixer features a premium metallic finish with a glass bowl so you can see the legendary planetary mixing in action.,https://s7d9.scene7.com/is/image/BedBathandBeyond/18650818518848p?scl=1|https://s7d9.scene7.com/is/image/BedBathandBeyond/31722742066569p?scl=1|https://s7d9.scene7.com/is/image/BedBathandBeyond/15067317603370p?scl=1|https://s7d9.scene7.com/is/image/BedBathandBeyond/64479144545093p?scl=1|https://s7d9.scene7.com/is/image/BedBathandBeyond/15067417603388p?scl=1|https://s7d9.scene7.com/is/image/BedBathandBeyond/31722842066576p?scl=1|https://s7d9.scene7.com/is/image/BedBathandBeyond/31722942066583p?scl=1|https://s7d9.scene7.com/is/image/BedBathandBeyond/18650918511363p?scl=1|https://s7d9.scene7.com/is/image/BedBathandBeyond/46977343004829p?scl=1|https://s7d9.scene7.com/is/image/BedBathandBeyond/113453960773944p?scl=1|https://s7d9.scene7.com/is/image/BedBathandBeyond/15710917825577p?scl=1|https://s7d2.scene7.com/is/image/BedBathandBeyond/31722742066569p?scl=1|https://s7d9.scene7.com/is/image/BedBathandBeyond/31722742066569p?scl=1|https://s7d9.scene7.com/is/image/BedBathandBeyond/31722742066569p__1?scl=1,KitchenAid® 5 qt. Artisan® Design Series Stand Mixer with Glass Bowl,299.99,,https://www.bedbathandbeyond.com/store/product/kitchenaid-reg-5-qt-artisan-reg-design-series-stand-mixer-with-glass-bowl/206965,ANTIQUE COPPER|BLUE|CANDY APPLE RED|CHAMPAGNE|ELECTRIC BLUE|PEARL|PLUMBERRY|RASPBERRY ICE|SEA GLASS|SLATE|SUGAR PEARL
As Seen on TV,Holiday|Christmas|Outdoor Christmas Decorations,USD,2017-12-07T00:05:40.392Z,The Star Shower Laser Light with Motion lets you easily illuminate your home year round without risking climbing ladders to hang lights on your house. Place the Star Showers Laser Light on the lawn to illuminate your landscape and home in seconds.,https://s7d1.scene7.com/is/image/BedBathandBeyond/102388646543110p?scl=1|https://s7d9.scene7.com/is/image/BedBathandBeyond/102388646543110p?scl=1|https://s7d9.scene7.com/is/image/BedBathandBeyond/102388646543110p__1?scl=1|https://s7d9.scene7.com/is/image/BedBathandBeyond/102388646543110p__2?scl=1|https://s7d9.scene7.com/is/image/BedBathandBeyond/102388646543110p__3?scl=1|https://s7d9.scene7.com/is/image/BedBathandBeyond/102388646543110p__4?scl=1,Star Shower® Laser Light with Motion,19.99,46543110,https://www.bedbathandbeyond.com/store/product/star-shower-reg-laser-light-with-motion/1046543110,
As Seen on TV,Kitchen|Kitchen Tools & Gadgets|Can & Jar Openers,USD,2017-12-07T00:05:41.124Z,"Robo Twist Hands Free Jar Opener allows you to open jars and bottles with ease. Hands-free technology grips, twists, and opens stubborn jar lids with the simple press of a button.",https://s7d2.scene7.com/is/image/BedBathandBeyond/88341746910295p?scl=1|https://s7d9.scene7.com/is/image/BedBathandBeyond/88341746910295p?scl=1|https://s7d9.scene7.com/is/image/BedBathandBeyond/88341746910295p__1?scl=1|https://s7d9.scene7.com/is/image/BedBathandBeyond/88341746910295p__2?scl=1|https://s7d9.scene7.com/is/image/BedBathandBeyond/88341746910295p__3?scl=1|https://s7d9.scene7.com/is/image/BedBathandBeyond/88341746910295p__4?scl=1,Robo Twist Hands Free Jar Opener,19.99,46910295,https://www.bedbathandbeyond.com/store/product/robo-twist-hands-free-jar-opener/1046910295,
Isotonic,Bedding|Bedding Basics|Bed Pillows|Build a Better Bed: Ultimate Luxury,USD,2017-12-07T00:05:41.758Z,"This irresistible pillow is perfect for side sleeping. It has 2"" gussetting and a high thread count offering the utmost in comfort.",https://s7d1.scene7.com/is/image/BedBathandBeyond/134617123682c?scl=1|https://s7d9.scene7.com/is/image/BedBathandBeyond/134617123682c?scl=1,Isotonic® Indulgence™ Side Sleeper Pillow,39.99,,https://www.bedbathandbeyond.com/store/product/isotonic-reg-indulgence-trade-side-sleeper-pillow/123682,
Fitbit,Gifts|Gifts by Category|Healthy Living,USD,2017-12-07T00:05:42.520Z,Keep track of your fitness goals in style with the Fitbit Charge 2 Activity Wristband. This revolutionary watch records how many calories you have burned and how far you have traveled. You can also log your workouts in order to map your progress.,https://s7d2.scene7.com/is/image/BedBathandBeyond/1048851232475c?scl=1|https://s7d9.scene7.com/is/image/BedBathandBeyond/1048851232475c?scl=1,Fitbit® Charge 2™ Wireless Activity Wristband,149.99,,https://www.bedbathandbeyond.com/store/product/fitbit-reg-charge-2-trade-wireless-activity-wristband/232475,
Donut Shop,More|Food & Drink|Coffee|Keurig® K-Cup® Pack The Original Donut Shop® Coffee,USD,2017-12-07T00:05:43.144Z,Enjoy an extra bold cup featuring creamy white chocolate accents and a candy cane finish with the Original Donut Shop Peppermint Bark Flavored Coffee. A delightful treat you can savor anytime especially when the weather turns chilly.,https://s7d2.scene7.com/is/image/BedBathandBeyond/68628244945497p?scl=1|https://s7d9.scene7.com/is/image/BedBathandBeyond/68628244945497p?scl=1,Keurig® K-Cup® Pack 18-Count The Original Donut Shop Peppermint Bark Flavored Coffee,11.99,44945497,https://www.bedbathandbeyond.com/store/product/keurig-reg-k-cup-reg-pack-18-count-the-original-donut-shop-peppermint-bark-flavored-coffee/1044945497,
Calphalon,Kitchen|Cookware|Cookware Sets,USD,2017-12-07T00:05:43.753Z,"Calphalon® Contemporary Nonstick cookware features heavy-gauge, hard-anodized aluminum construction for durability and rapid, even heating. Contemporary design with multi-layer nonstick ensures exceptional cooking performance and lasting use.",https://s7d1.scene7.com/is/image/BedBathandBeyond/59912013015406p?scl=1|https://s7d9.scene7.com/is/image/BedBathandBeyond/59912013015406p?scl=1|https://s7d9.scene7.com/is/image/BedBathandBeyond/59912013015406p__1?scl=1|https://s7d9.scene7.com/is/image/BedBathandBeyond/59912013015406p__2?scl=1|https://s7d9.scene7.com/is/image/BedBathandBeyond/59912013015406p__3?scl=1|https://s7d9.scene7.com/is/image/BedBathandBeyond/59912013015406p__4?scl=1,Calphalon® Contemporary Nonstick 8-Piece Cookware Set,349.99,,https://www.bedbathandbeyond.com/store/product/calphalon-reg-contemporary-nonstick-8-piece-cookware-set/104198,
Oster,Dining|Bar & Wine|Wine Accessories,USD,2017-12-07T00:05:44.503Z,"This electric wine bottle opener offers effortless entertainment at the touch of a button. When fully charged, its cordless operation easily opens up to 30 bottles of wine, and sits in the compact recharging base for convenience and mobility.",https://s7d1.scene7.com/is/image/BedBathandBeyond/7367114620168p?scl=1|https://s7d9.scene7.com/is/image/BedBathandBeyond/7367114620168p?scl=1|https://s7d9.scene7.com/is/image/BedBathandBeyond/7367114620168p__1?scl=1,Oster® Electric Wine Bottle Opener,17.99,14620168,https://www.bedbathandbeyond.com/store/product/oster-reg-electric-wine-bottle-opener/1014620168,
Loft Living,More|Apparel & Accessories|Men's Apparel & Accessories,USD,2017-12-07T00:05:45.193Z,"Ultra-soft and comfortable, the Men's Memory Foam Nordic Clog Slipper from Loft Living will bring luxury to your feet. Crafted of flexible, non-skid construction, its temperature sensitive foam cradles your feet for a cozy feel.",https://s7d9.scene7.com/is/image/BedBathandBeyond/131441262215022p?scl=1|https://s7d9.scene7.com/is/image/BedBathandBeyond/131441362214988p?scl=1|https://s7d9.scene7.com/is/image/BedBathandBeyond/131441462214940p?scl=1|https://s7d1.scene7.com/is/image/BedBathandBeyond/131441362214988p?scl=1|https://s7d9.scene7.com/is/image/BedBathandBeyond/131441362214988p?scl=1|https://s7d9.scene7.com/is/image/BedBathandBeyond/131441362214988p__1?scl=1|https://s7d9.scene7.com/is/image/BedBathandBeyond/131441362214988p__2?scl=1,Loft Living Men's Memory Foam Nordic Clog Slipper,9.99,,https://www.bedbathandbeyond.com/store/product/loft-living-men-39-s-memory-foam-nordic-clog-slipper/3333114,BLACK|BROWN|TAN
Waterpik,Health & Beauty|Oral Care|Waterpiks & Floss,USD,2017-12-07T00:05:45.765Z,Achieve healthier gums and enhance cleaning between dental visits with the compact and convenient Cordless Plus Waterflosser from Waterpik. This rechargeable dental care tool features an ergonomic design and a variety of attachments.,https://s7d1.scene7.com/is/image/BedBathandBeyond/122017814660976p?scl=1|https://s7d9.scene7.com/is/image/BedBathandBeyond/122017814660976p?scl=1|https://s7d9.scene7.com/is/image/BedBathandBeyond/122017814660976p__1?scl=1|https://s7d9.scene7.com/is/image/BedBathandBeyond/122017814660976p__2?scl=1|https://s7d9.scene7.com/is/image/BedBathandBeyond/122017814660976p__3?scl=1|https://s7d9.scene7.com/is/image/BedBathandBeyond/122017814660976p__4?scl=1,Waterpik® Cordless Plus Waterflosser® in White,54.99,14660976,https://www.bedbathandbeyond.com/store/product/waterpik-reg-cordless-plus-waterflosser-reg-in-white/119004,
BedBathAndBeyond,Storage & Cleaning|Desk Organization|Office Accessories,USD,2017-12-07T00:05:46.457Z,"This 6-Pocket Armrest Organizer with Tray Top makes it easy to keep essentials neat and in easy reach when relaxing on the couch or in a chair. Its adjustable body allows it to fit easily over furniture arms. The handy tray top is useful for snacks, too.",https://s7d2.scene7.com/is/image/BedBathandBeyond/70964444588403p?scl=1|https://s7d9.scene7.com/is/image/BedBathandBeyond/70964444588403p?scl=1|https://s7d9.scene7.com/is/image/BedBathandBeyond/70964444588403p__1?scl=1|https://s7d9.scene7.com/is/image/BedBathandBeyond/70964444588403p__2?scl=1|https://s7d9.scene7.com/is/image/BedBathandBeyond/70964444588403p__3?scl=1,6-Pocket Armrest Organizer with Tray Top in Black,9.99,44588403,https://www.bedbathandbeyond.com/store/product/6-pocket-armrest-organizer-with-tray-top-in-black/1044588403,
Brookstone,Dining|Bar & Wine|Wine Accessories,USD,2017-12-07T00:05:46.897Z,Brookstone Automatic Wine Opener allows one-touch operation that easily removes wine corks. Works with natural and synthetic corks.,https://s7d2.scene7.com/is/image/BedBathandBeyond/110059318522721p?scl=1|https://s7d9.scene7.com/is/image/BedBathandBeyond/110059318522721p?scl=1|https://s7d9.scene7.com/is/image/BedBathandBeyond/110059318522721p__1?scl=1,Brookstone® Automatic Wine Opener,19.99,18522721,https://www.bedbathandbeyond.com/store/product/brookstone-reg-automatic-wine-opener/1018522721,
Therapedic,Home Decor|Decorative Accessories|Blankets & Throws,USD,2017-12-07T00:05:47.563Z,"Keep yourself warm and cozy while you relaxing in bed or working at your desk with the Therapedic Warm Me Up Electric Heated Wrap. Designed with 4 heat settings, the wrap provides soothing therapeutic warmth wherever you go.",https://s7d9.scene7.com/is/image/BedBathandBeyond/77278844386078p?scl=1|https://s7d9.scene7.com/is/image/BedBathandBeyond/102363247082595p?scl=1|https://s7d9.scene7.com/is/image/BedBathandBeyond/63004044386085p?scl=1|https://s7d1.scene7.com/is/image/BedBathandBeyond/77278844386078p?scl=1|https://s7d9.scene7.com/is/image/BedBathandBeyond/77278844386078p?scl=1|https://s7d9.scene7.com/is/image/BedBathandBeyond/77278844386078p__1?scl=1|https://s7d9.scene7.com/is/image/BedBathandBeyond/77278844386078p__2?scl=1|https://s7d9.scene7.com/is/image/BedBathandBeyond/77278844386078p__3?scl=1|https://s7d9.scene7.com/is/image/BedBathandBeyond/77278844386078p__4?scl=1,Therapedic® Warm Me Up Electric Heated Wrap,49.99,,https://www.bedbathandbeyond.com/store/product/therapedic-reg-warm-me-up-electric-heated-wrap/3272082,BLACK|NAVY|TAUPE
BedBathAndBeyond,"Kitchen|Kitchen Tools & Gadgets|Choppers, Graters & Slicers",USD,2017-12-07T00:05:48.357Z,"The Vidalia Chop Wizard is the fastest, safest, and easiest way to chop or dice fruits and vegetables. Simply place the item on top of the stainless steel blade grate and with one swift motion, swing the top lid down.",https://s7d1.scene7.com/is/image/BedBathandBeyond/6529314556052p?scl=1|https://s7d9.scene7.com/is/image/BedBathandBeyond/6529314556052p?scl=1|https://s7d9.scene7.com/is/image/BedBathandBeyond/6529314556052p__1?scl=1|https://s7d9.scene7.com/is/image/BedBathandBeyond/6529314556052p__2?scl=1,Vidalia Chop Wizard™,19.99,14556052,https://www.bedbathandbeyond.com/store/product/vidalia-chop-wizard-trade/1014556052,
