product>>brand,product>>categories,product>>currency,product>>date,product>>description,product>>images,product>>name,product>>price,product>>sku,product>>url,product>>variations
Marchesa Notte,Clothing|Luxe|Women|Evening Dresses|Evening Dresses,USD,2018-01-14T21:01:46.577Z,"Marchesa’s sister-line, Marchesa Notte, continues to exhibit the brand’s dedication to show-stopping flourishes, noteworthy attention to detail and feminine glamour. This stunning powder blue dress is from the label’s AW17 pre-collection, inspired by the idea of all-night dance attire. It features a figure-flattering corseted top with a sweetheart neckline, a rear zip fastening, a fitted waist and adjustable shoulder straps. The flared skirt boasts a dramatically curved high-low hemline while the body is adorned with multicoloured embroidered flowers.",https://cdn-images.farfetch-contents.com/12/09/38/34/12093834_10180864_1000.jpg|https://cdn-images.farfetch-contents.com/12/09/38/34/12093834_10180868_1000.jpg|https://cdn-images.farfetch-contents.com/12/09/38/34/12093834_10180872_1000.jpg|https://cdn-images.farfetch-contents.com/12/09/38/34/12093834_10180875_1000.jpg|https://cdn-images.farfetch-contents.com/12/09/38/34/12093834_10180879_1000.jpg,floral embroidered high-low dress,930.75,12093834,https://www.farfetch.com/shopping/women/marchesa-notte-floral-embroidered-high-low-dress-item-12093834.aspx,POWDER BLUE
Marchesa Notte,Clothing|Luxe|Women|Evening Dresses|Evening Dresses,USD,2018-01-14T21:01:49.879Z,"Gold-tone floral embroidered gown from Marchesa Notte featuring a plunging neck, a sleeveless design, a rear zip fastening, a fitted waist and a long length.",https://cdn-images.farfetch-contents.com/12/09/38/29/12093829_10123885_1000.jpg|https://cdn-images.farfetch-contents.com/12/09/38/29/12093829_10123908_1000.jpg|https://cdn-images.farfetch-contents.com/12/09/38/29/12093829_10123930_1000.jpg|https://cdn-images.farfetch-contents.com/12/09/38/29/12093829_10123948_1000.jpg|https://cdn-images.farfetch-contents.com/12/09/38/29/12093829_10123973_1000.jpg,floral embroidered gown,497.5,12093829,https://www.farfetch.com/shopping/women/marchesa-notte-floral-embroidered-gown-item-12093829.aspx,Gold
Marchesa,Clothing|Luxe|Women|Evening Dresses|Evening Dresses,USD,2018-01-14T21:01:52.863Z,"Named after the heiress and muse Marchesa Luisa Casati who was so fabulous she walked her two pet leopards on diamond leashes, Marchesa creates magical pieces for the modern day princess. Nothing to wear to the ball, Cinderella? Don't worry, the fairy tale designs of Keren Craig and Georgina have got you covered. A subtle sweetheart curved neckline, sculpted bodice, embroidered details and full tulle skirt make this dress fit for royalty. Intricate embroidered floral filigree details trail over the corset of the gown into a dropped waist, flowing into the ultimately feminine hazy full tulle skirt. Have your regal moment in a dress that was built for twirling around a dance floor.",https://cdn-images.farfetch-contents.com/11/95/00/02/11950002_9134462_1000.jpg|https://cdn-images.farfetch-contents.com/11/95/00/02/11950002_9134470_1000.jpg|https://cdn-images.farfetch-contents.com/11/95/00/02/11950002_9134480_1000.jpg|https://cdn-images.farfetch-contents.com/11/95/00/02/11950002_9134485_1000.jpg|https://cdn-images.farfetch-contents.com/11/95/00/02/11950002_9134492_1000.jpg,strapless tulle ball gown,10291.33,11950002,https://www.farfetch.com/shopping/women/marchesa-strapless-tulle-ball-gown-item-11950002.aspx,ICE GREY
Marchesa Notte,Clothing|Luxe|Women|Evening Dresses|Evening Dresses,USD,2018-01-14T21:01:55.908Z,"Marchesa’s sister-line, Marchesa Notte, continues to exhibit the brand’s dedication to show-stopping flourishes, noteworthy attention to detail and feminine glamour. This stunning black net dress is from the label’s AW17 pre-collection, inspired by the idea of all-night dance attire. It features a figure-flattering corseted top with a sweetheart neckline, a rear zip fastening, a fitted waist and adjustable shoulder straps. The flared skirt boasts a dramatically curved high-low hemline while the body is adorned with multicoloured embroidered flowers.",https://cdn-images.farfetch-contents.com/12/09/38/35/12093835_10180882_1000.jpg|https://cdn-images.farfetch-contents.com/12/09/38/35/12093835_10180885_1000.jpg|https://cdn-images.farfetch-contents.com/12/09/38/35/12093835_10180886_1000.jpg|https://cdn-images.farfetch-contents.com/12/09/38/35/12093835_10180889_1000.jpg|https://cdn-images.farfetch-contents.com/12/09/38/35/12093835_10180891_1000.jpg,floral embroidered high-low dress,930.75,12093835,https://www.farfetch.com/shopping/women/marchesa-notte-floral-embroidered-high-low-dress-item-12093835.aspx,BLACK
Fenty X Puma,Shoes|Luxe|Women|Sandals|Sandals,USD,2018-01-14T21:01:58.885Z,Bay green furry pool slides from Fenty X Puma.,https://cdn-images.farfetch-contents.com/12/17/14/61/12171461_10266006_1000.jpg|https://cdn-images.farfetch-contents.com/12/17/14/61/12171461_10266007_1000.jpg|https://cdn-images.farfetch-contents.com/12/17/14/61/12171461_10266008_1000.jpg|https://cdn-images.farfetch-contents.com/12/17/14/61/12171461_10266009_1000.jpg,furry pool slides,63,12171461,https://www.farfetch.com/shopping/women/fenty-x-puma-furry-pool-slides-item-12171461.aspx,01 LIGHT GREEN
Amiri,Clothing|Luxe|Women|Skinny Jeans|Skinny Jeans,USD,2018-01-14T21:02:01.971Z,"Light blue cotton blend distressed skinny jeans from Amiri featuring a button and zip fly, a five pocket design, a cropped length, zip cuffs and distressed effects.",https://cdn-images.farfetch-contents.com/12/33/90/24/12339024_11052394_1000.jpg|https://cdn-images.farfetch-contents.com/12/33/90/24/12339024_11052396_1000.jpg|https://cdn-images.farfetch-contents.com/12/33/90/24/12339024_11052388_1000.jpg|https://cdn-images.farfetch-contents.com/12/33/90/24/12339024_11052393_1000.jpg|https://cdn-images.farfetch-contents.com/12/33/90/24/12339024_11052391_1000.jpg,distressed skinny jeans,1710.22,12339024,https://www.farfetch.com/shopping/women/amiri-distressed-skinny-jeans-item-12339024.aspx,DENIM
Simonetta Ravizza,Clothing|Luxe|Women|Fur & Shearling Coats|Fur & Shearling Coats,USD,2018-01-14T21:02:04.990Z,Brown sable and silk panelled fur coat from Simonetta Ravizza.,https://cdn-images.farfetch-contents.com/12/32/12/54/12321254_11393671_1000.jpg|https://cdn-images.farfetch-contents.com/12/32/12/54/12321254_11393674_1000.jpg|https://cdn-images.farfetch-contents.com/12/32/12/54/12321254_11393678_1000.jpg|https://cdn-images.farfetch-contents.com/12/32/12/54/12321254_11393679_1000.jpg|https://cdn-images.farfetch-contents.com/12/32/12/54/12321254_11393684_1000.jpg,panelled fur coat,31756.1,12321254,https://www.farfetch.com/shopping/women/simonetta-ravizza-panelled-fur-coat-item-12321254.aspx,150 BROWN
Marchesa Notte,Clothing|Luxe|Women|Evening Dresses|Evening Dresses,USD,2018-01-14T21:02:07.733Z,"Marchesa’s sister-line, Marchesa Notte, continues to exhibit the brand’s dedication to show-stopping flourishes, noteworthy attention to detail and feminine glamour. This stunning powder blue gown is from the label’s AW17 pre-collection, inspired by the idea of all-night dance attire. It features a figure-flattering corseted top with a sweetheart neckline, a rear zip fastening, a fitted waist and adjustable shoulder straps. The flared skirt boasts a floor-skimming length while the body is adorned with multicoloured embroidered flowers.",https://cdn-images.farfetch-contents.com/12/09/38/28/12093828_10180831_1000.jpg|https://cdn-images.farfetch-contents.com/12/09/38/28/12093828_10180833_1000.jpg|https://cdn-images.farfetch-contents.com/12/09/38/28/12093828_10180836_1000.jpg|https://cdn-images.farfetch-contents.com/12/09/38/28/12093828_10180839_1000.jpg|https://cdn-images.farfetch-contents.com/12/09/38/28/12093828_10180842_1000.jpg,floral embroidered gown,836.5,12093828,https://www.farfetch.com/shopping/women/marchesa-notte-floral-embroidered-gown-item-12093828.aspx,POWDER BLUE
Oscar de la Renta,Clothing|Luxe|Women|Evening Dresses|Evening Dresses,USD,2018-01-14T21:02:10.470Z,Off-white embroidered flared gown from Oscar de la Renta.,https://cdn-images.farfetch-contents.com/12/20/41/87/12204187_10474406_1000.jpg|https://cdn-images.farfetch-contents.com/12/20/41/87/12204187_10474408_1000.jpg|https://cdn-images.farfetch-contents.com/12/20/41/87/12204187_10474410_1000.jpg|https://cdn-images.farfetch-contents.com/12/20/41/87/12204187_10474411_1000.jpg|https://cdn-images.farfetch-contents.com/12/20/41/87/12204187_10474414_1000.jpg,embroidered flared gown,5329.5,12204187,https://www.farfetch.com/shopping/women/oscar-de-la-renta-embroidered-flared-gown-item-12204187.aspx,CHAMPAGNE
Marchesa Notte,Clothing|Luxe|Women|Evening Dresses|Evening Dresses,USD,2018-01-14T21:02:13.400Z,"Green and black rose embroidered gown from Marchesa Notte featuring a round neck, three-quarter length sleeves, a concealed rear zip fastening, a flared style and a long length.",https://cdn-images.farfetch-contents.com/12/09/38/32/12093832_9802827_1000.jpg|https://cdn-images.farfetch-contents.com/12/09/38/32/12093832_9802832_1000.jpg|https://cdn-images.farfetch-contents.com/12/09/38/32/12093832_9802835_1000.jpg|https://cdn-images.farfetch-contents.com/12/09/38/32/12093832_9802838_1000.jpg|https://cdn-images.farfetch-contents.com/12/09/38/32/12093832_9802841_1000.jpg,rose embroidered gown,760.75,12093832,https://www.farfetch.com/shopping/women/marchesa-notte-rose-embroidered-gown-item-12093832.aspx,GREEN
Marchesa Notte,Clothing|Luxe|Women|Evening Dresses|Evening Dresses,USD,2018-01-14T21:02:16.364Z,"Blush nude floral embroidered long dress from Marchesa Notte featuring a scoop neck, three-quarter length sleeves, a sheer construction, a waistband, a rear zip fastening and a pleated hem.",https://cdn-images.farfetch-contents.com/12/09/38/46/12093846_9802938_1000.jpg|https://cdn-images.farfetch-contents.com/12/09/38/46/12093846_9802941_1000.jpg|https://cdn-images.farfetch-contents.com/12/09/38/46/12093846_9802944_1000.jpg|https://cdn-images.farfetch-contents.com/12/09/38/46/12093846_9802946_1000.jpg|https://cdn-images.farfetch-contents.com/12/09/38/46/12093846_9802949_1000.jpg,floral embroidered long dress,1100.75,12093846,https://www.farfetch.com/shopping/women/marchesa-notte-floral-embroidered-long-dress-item-12093846.aspx,blush
Stella McCartney,Shoes|Luxe|Women|Lace-up Shoes|Lace-up Shoes,USD,2018-01-14T21:02:19.422Z,"Blue artificial leather 'Elyse' lace-up shoes from Stella McCartney featuring a square toe, a lace-up front fastening, glitter details, a high wedge heel and a ridged rubber sole.",https://cdn-images.farfetch-contents.com/11/50/80/47/11508047_7306576_1000.jpg|https://cdn-images.farfetch-contents.com/11/50/80/47/11508047_7306580_1000.jpg|https://cdn-images.farfetch-contents.com/11/50/80/47/11508047_7306584_1000.jpg,'Elyse' lace-up shoes,550,11508047,https://www.farfetch.com/shopping/women/stella-mccartney--elyse-lace-up-shoes-item-11508047.aspx,
Saint Laurent,Clothing|Luxe|Women|Skinny Jeans|Skinny Jeans,USD,2018-01-14T21:02:22.694Z,"Black stretch cotton ripped skinny jeans from Saint Laurent featuring a button & zip fastening, belt loops and a five pocket design.",https://cdn-images.farfetch-contents.com/11/09/17/03/11091703_5255706_1000.jpg|https://cdn-images.farfetch-contents.com/11/09/17/03/11091703_5255708_1000.jpg|https://cdn-images.farfetch-contents.com/11/09/17/03/11091703_5255710_1000.jpg|https://cdn-images.farfetch-contents.com/11/09/17/03/11091703_5255712_1000.jpg|https://cdn-images.farfetch-contents.com/11/09/17/03/11091703_5255714_1000.jpg,ripped skinny jeans,534,11091703,https://www.farfetch.com/shopping/women/saint-laurent-ripped-skinny-jeans-item-11091703.aspx,4075 BLACK
Marchesa Notte,Clothing|Luxe|Women|Evening Dresses|Evening Dresses,USD,2018-01-14T21:02:25.603Z,"Champagne floral bead embellished gown from Marchesa Notte featuring a sleeveless design, a rear zip fastening, a pleated skirt, a long length and cross-over straps at the chest.",https://cdn-images.farfetch-contents.com/12/09/38/56/12093856_9803027_1000.jpg|https://cdn-images.farfetch-contents.com/12/09/38/56/12093856_9803030_1000.jpg|https://cdn-images.farfetch-contents.com/12/09/38/56/12093856_9803034_1000.jpg|https://cdn-images.farfetch-contents.com/12/09/38/56/12093856_9803037_1000.jpg|https://cdn-images.farfetch-contents.com/12/09/38/56/12093856_9803040_1000.jpg,floral bead embellished gown,1100.75,12093856,https://www.farfetch.com/shopping/women/marchesa-notte-floral-bead-embellished-gown-item-12093856.aspx,CHAMPAGNE
Givenchy,Shoes|Luxe|Women|Boots|Boots,USD,2018-01-14T21:02:28.635Z,"Givenchy’s red leather Shark Lock boots are a stand-out design for the luxury French fashion house. Cut for a mid-calf fit, this pair features an almond toe, a concealed side zip fastening, a foldover top panel with a silver-tone shark tooth motif twist-lock fastening and a high wedge heel.",https://cdn-images.farfetch-contents.com/12/48/35/15/12483515_11621638_1000.jpg|https://cdn-images.farfetch-contents.com/12/48/35/15/12483515_11621644_1000.jpg|https://cdn-images.farfetch-contents.com/12/48/35/15/12483515_11621650_1000.jpg|https://cdn-images.farfetch-contents.com/12/48/35/15/12483515_11621655_1000.jpg,Shark Lock boots,1110,12483515,https://www.farfetch.com/shopping/women/givenchy-shark-lock-boots-item-12483515.aspx,600 RED
Stella McCartney,Clothing|Luxe|Women|Blouses|Blouses,USD,2018-01-14T21:02:31.577Z,"Cream silk half-placket blouse from Stella McCartney featuring a striped pattern, a front button placket, a round neck and long sleeves.",https://cdn-images.farfetch-contents.com/11/93/09/42/11930942_9128145_1000.jpg|https://cdn-images.farfetch-contents.com/11/93/09/42/11930942_9128147_1000.jpg|https://cdn-images.farfetch-contents.com/11/93/09/42/11930942_9128149_1000.jpg|https://cdn-images.farfetch-contents.com/11/93/09/42/11930942_9128151_1000.jpg|https://cdn-images.farfetch-contents.com/11/93/09/42/11930942_9128153_1000.jpg,half-placket blouse,306,11930942,https://www.farfetch.com/shopping/women/stella-mccartney-half-placket-blouse-item-11930942.aspx,9200 CREAM
Dolce & Gabbana,Clothing|Luxe|Women|Evening Dresses|Evening Dresses,USD,2018-01-14T21:02:34.776Z,"Black and white stretch silk blend polka dot midi dress from Dolce & Gabbana featuring a square neck, a polka dot pattern, a fitted waist, ruffled sleeves, a v-back, a rear zip fastening and a knee length.",https://cdn-images.farfetch-contents.com/11/86/17/81/11861781_8738633_1000.jpg|https://cdn-images.farfetch-contents.com/11/86/17/81/11861781_8738637_1000.jpg|https://cdn-images.farfetch-contents.com/11/86/17/81/11861781_8738639_1000.jpg|https://cdn-images.farfetch-contents.com/11/86/17/81/11861781_8738641_1000.jpg|https://cdn-images.farfetch-contents.com/11/86/17/81/11861781_8738643_1000.jpg,polka dot midi dress,1038,11861781,https://www.farfetch.com/shopping/women/dolce-gabbana-polka-dot-midi-dress-item-11861781.aspx,HWAPNBLACK
Marchesa Notte,Clothing|Luxe|Women|Evening Dresses|Evening Dresses,USD,2018-01-14T21:02:37.795Z,"Marchesa’s sister-line, Marchesa Notte, continues to exhibit the brand’s dedication to show-stopping flourishes, noteworthy attention to detail and feminine glamour. This layered lace gown is from the label’s AW17 pre-collection, inspired by the idea of all-night dance attire. It has been immaculately fashioned from voluminous white tulle, boasting a v-neckline, a sleeveless design, a rear zip fastening, a fitted waist, a delicately scalloped lace trimming and a long-length skirt with a dramatic tiered effect.",https://cdn-images.farfetch-contents.com/12/09/38/47/12093847_10180922_1000.jpg|https://cdn-images.farfetch-contents.com/12/09/38/47/12093847_10180924_1000.jpg|https://cdn-images.farfetch-contents.com/12/09/38/47/12093847_10180926_1000.jpg|https://cdn-images.farfetch-contents.com/12/09/38/47/12093847_10180930_1000.jpg|https://cdn-images.farfetch-contents.com/12/09/38/47/12093847_10180933_1000.jpg,layered lace gown,696.5,12093847,https://www.farfetch.com/shopping/women/marchesa-notte-layered-lace-gown-item-12093847.aspx,IVORY
Marchesa Notte,Clothing|Luxe|Women|Evening Dresses|Evening Dresses,USD,2018-01-14T21:02:40.852Z,Tan and pink asymmetric hem floral dress from Marchesa Notte.,https://cdn-images.farfetch-contents.com/11/90/25/74/11902574_8981944_1000.jpg|https://cdn-images.farfetch-contents.com/11/90/25/74/11902574_8981947_1000.jpg|https://cdn-images.farfetch-contents.com/11/90/25/74/11902574_8981951_1000.jpg|https://cdn-images.farfetch-contents.com/11/90/25/74/11902574_8981957_1000.jpg|https://cdn-images.farfetch-contents.com/11/90/25/74/11902574_8981961_1000.jpg,asymmetric hem floral dress,597,11902574,https://www.farfetch.com/shopping/women/marchesa-notte-asymmetric-hem-floral-dress-item-11902574.aspx,blush
Givenchy,Clothing|Luxe|Women|Evening Dresses|Evening Dresses,USD,2018-01-14T21:02:44.032Z,"Black and gold silk floral embroidered shift dress from Givenchy featuring a round neck, a sleeveless design, a shift silhouette, an embroidered floral design, a concealed rear zip fastening, a knee length and a rear central vent.",https://cdn-images.farfetch-contents.com/11/60/98/74/11609874_7610379_1000.jpg|https://cdn-images.farfetch-contents.com/11/60/98/74/11609874_7610380_1000.jpg|https://cdn-images.farfetch-contents.com/11/60/98/74/11609874_7610376_1000.jpg|https://cdn-images.farfetch-contents.com/11/60/98/74/11609874_7610378_1000.jpg|https://cdn-images.farfetch-contents.com/11/60/98/74/11609874_7610373_1000.jpg,floral embroidered shift dress,1497,11609874,https://www.farfetch.com/shopping/women/givenchy-floral-embroidered-shift-dress-item-11609874.aspx,
Dsquared2,Clothing|Luxe|Women|Oversized Jackets|Oversized Jackets,USD,2018-01-14T21:02:47.114Z,"DSQUARED2's AW17 collection was inspired by hiking attire and the Canadian winter, with the designers taking their quirky styling out to the slopes for what the Caten twins call 'glamourous mountaineering'. This bold orange K-Way pullover jacket from DSQUARED2 features wide lapels, a hood with toggle fastenings, a front zip, a K-Way print at the chest, two front pockets, a front zip pocket and long sleeves with a printed logo to the right sleeve.",https://cdn-images.farfetch-contents.com/12/33/10/64/12331064_10952730_1000.jpg|https://cdn-images.farfetch-contents.com/12/33/10/64/12331064_10952737_1000.jpg|https://cdn-images.farfetch-contents.com/12/33/10/64/12331064_10952746_1000.jpg|https://cdn-images.farfetch-contents.com/12/33/10/64/12331064_10952754_1000.jpg|https://cdn-images.farfetch-contents.com/12/33/10/64/12331064_10952768_1000.jpg|https://cdn-images.farfetch-contents.com/12/33/10/64/12331064_10952783_1000.jpg,K-Way pullover jacket,309,12331064,https://www.farfetch.com/shopping/women/dsquared2-k-way-pullover-jacket-item-12331064.aspx,
Michael Michael Kors,Shoes|Luxe|Women|Trainers|Trainers,USD,2018-01-14T21:02:50.015Z,"Grey cotton, leather and rubber eyelet detail sneakers from Michael Michael Kors.",https://cdn-images.farfetch-contents.com/12/24/48/05/12244805_10561034_1000.jpg|https://cdn-images.farfetch-contents.com/12/24/48/05/12244805_10561043_1000.jpg|https://cdn-images.farfetch-contents.com/12/24/48/05/12244805_10561053_1000.jpg|https://cdn-images.farfetch-contents.com/12/24/48/05/12244805_10561061_1000.jpg,eyelet detail sneakers,128.48,12244805,https://www.farfetch.com/shopping/women/michael-michael-kors-eyelet-detail-sneakers-item-12244805.aspx,
Off-White,Shoes|Luxe|Women|Boots|Boots,USD,2018-01-14T21:02:52.939Z,"Designed to link the gap between streetwear and high-end fashion, Off-White features pieces that look lived in and that are made for all-day wear. Expertly constructed from black leather, these ""For Walking"" knee-high boots from Off-White feature a pointed toe, a slip-on style, a print to the side and a high stiletto heel.",https://cdn-images.farfetch-contents.com/12/36/56/90/12365690_11100735_1000.jpg|https://cdn-images.farfetch-contents.com/12/36/56/90/12365690_11100736_1000.jpg|https://cdn-images.farfetch-contents.com/12/36/56/90/12365690_11100737_1000.jpg|https://cdn-images.farfetch-contents.com/12/36/56/90/12365690_11100738_1000.jpg,"""For Walking"" knee-high boots",1020.5,12365690,https://www.farfetch.com/shopping/women/off-white--for-walking-knee-high-boots-item-12365690.aspx,black white
Proenza Schouler,Clothing|Luxe|Women|Biker Jackets|Biker Jackets,USD,2018-01-14T21:02:55.982Z,"Combining silhouettes and design ideas in a collage-inspired manner, this motorcycle jacket functions as a showcase for the Proenza Schouler aesthetic. Crafted in Italy from a washed Italian lambskin, this dense yet soft piece has an overlapping cape-style lapel that contrasts against the fitted buttoned collar and structured back. An asymmetrical design, this directional take on the tough-luxe trend features long sleeves with decorative stitching and zipper cuff details with attached logo lanyards. 100% genuine lamb shearling. Made in Italy.",https://cdn-images.farfetch-contents.com/12/35/08/95/12350895_11032201_1000.jpg|https://cdn-images.farfetch-contents.com/12/35/08/95/12350895_11032203_1000.jpg|https://cdn-images.farfetch-contents.com/12/35/08/95/12350895_11032205_1000.jpg|https://cdn-images.farfetch-contents.com/12/35/08/95/12350895_11032207_1000.jpg|https://cdn-images.farfetch-contents.com/12/35/08/95/12350895_11032210_1000.jpg,Leather Belted Moto Jacket with Shearling Panel,1732.5,12350895,https://www.farfetch.com/shopping/women/proenza-schouler-leather-belted-moto-jacket-with-shearling-panel-item-12350895.aspx,
Marcelo Burlon County Of Milan,Clothing|Luxe|Women|Track Pants|Track Pants,USD,2018-01-14T21:02:58.841Z,"Enter the world of fabulous luxury and everlasting ease with these black logo print track pants from Marcelo Burlon County of Milan. Crafted from cotton, they feature an elasticated waistband with a drawstring fastening, side pockets and a print to the side.",https://cdn-images.farfetch-contents.com/12/17/88/21/12178821_10318749_1000.jpg|https://cdn-images.farfetch-contents.com/12/17/88/21/12178821_10318754_1000.jpg|https://cdn-images.farfetch-contents.com/12/17/88/21/12178821_10318759_1000.jpg|https://cdn-images.farfetch-contents.com/12/17/88/21/12178821_10318764_1000.jpg|https://cdn-images.farfetch-contents.com/12/17/88/21/12178821_10318771_1000.jpg,logo print track pants,163.2,12178821,https://www.farfetch.com/shopping/women/marcelo-burlon-county-of-milan-logo-print-track-pants-item-12178821.aspx,1088 BLACK
Balmain,Clothing|Luxe|Women|Leather Jackets|Leather Jackets,USD,2018-01-14T21:03:01.916Z,"Olivier Rousteing implements a ‘more is more’ philosophy which showed no boundaries in Balmain’s AW17 collection. Expect a visually rich line-up of opulent fabrics, daring cuts and his signature decadent embellishing. Crafted from a soft cotton blend and calf leather, this biker jacket from Balmain features classic lapels, a front zip fastening, front pockets, a cropped length and long sleeves with a lace-up detail.",https://cdn-images.farfetch-contents.com/12/28/40/52/12284052_10719789_1000.jpg|https://cdn-images.farfetch-contents.com/12/28/40/52/12284052_10719790_1000.jpg|https://cdn-images.farfetch-contents.com/12/28/40/52/12284052_10719791_1000.jpg|https://cdn-images.farfetch-contents.com/12/28/40/52/12284052_10719792_1000.jpg|https://cdn-images.farfetch-contents.com/12/28/40/52/12284052_10719793_1000.jpg,cropped biker jacket,2147.3,12284052,https://www.farfetch.com/shopping/women/balmain-cropped-biker-jacket-item-12284052.aspx,C0100BLACK
Michael Michael Kors,Shoes|Luxe|Women|Loafers|Loafers,USD,2018-01-14T21:03:04.834Z,Black leather platform loafers from Michael Michael Kors.,https://cdn-images.farfetch-contents.com/12/24/97/98/12249798_10683604_1000.jpg|https://cdn-images.farfetch-contents.com/12/24/97/98/12249798_10683606_1000.jpg|https://cdn-images.farfetch-contents.com/12/24/97/98/12249798_10683607_1000.jpg|https://cdn-images.farfetch-contents.com/12/24/97/98/12249798_10683609_1000.jpg,platform loafers,139.61,12249798,https://www.farfetch.com/shopping/women/michael-michael-kors-platform-loafers--item-12249798.aspx,BLACK
Alexander Wang,Clothing|Luxe|Women|Fitted Skirts|Fitted Skirts,USD,2018-01-14T21:03:07.806Z,"The dark composition and studded trim of this mini skirt is typically Alexander Wang, with other features including rounded stud embellishments and a ruffled hem. This skirt would match a fitted jacket and courts perfectly.",https://cdn-images.farfetch-contents.com/12/13/20/72/12132072_10383638_1000.jpg|https://cdn-images.farfetch-contents.com/12/13/20/72/12132072_10383639_1000.jpg|https://cdn-images.farfetch-contents.com/12/13/20/72/12132072_10383640_1000.jpg|https://cdn-images.farfetch-contents.com/12/13/20/72/12132072_10383641_1000.jpg|https://cdn-images.farfetch-contents.com/12/13/20/72/12132072_10383642_1000.jpg,studded trim ruffled skirt,670.86,12132072,https://www.farfetch.com/shopping/women/alexander-wang-studded-trim-ruffled-skirt-item-12132072.aspx,Onyx
